{
  "$schema": "https://json-schema.org/draft/2020-12/schema",
  "$id": "r4_public_core_local_postgres_integration_campaign_inspect_missing_correction_evidence.schema.json",
  "title": "R4 Public Core Local PostgreSQL Integration Campaign Inspect-Missing Correction Evidence",
  "type": "object",
  "additionalProperties": false,
  "required": [
    "schemaVersion",
    "status",
    "generatedAt",
    "authority",
    "lineage",
    "workset",
    "constructedContracts",
    "validation",
    "effectAudit",
    "documentationScope",
    "artifacts",
    "audits",
    "readiness",
    "stop"
  ],
  "properties": {
    "schemaVersion": {
      "const": "r4_public_core_local_postgres_integration_campaign_inspect_missing_correction_evidence.v1"
    },
    "status": {
      "const": "LOCAL_POSTGRES_INTEGRATION_CAMPAIGN_INSPECT_MISSING_CORRECTION_IMPLEMENTATION_EVIDENCE_GREEN_STATUS_FREEZE_REQUIRED_FRESH_INTEGRATION_CAMPAIGN_V2_EXECUTION_APPROVAL_REQUIRED_PRODUCTION_NOT_REQUESTED_GATE_C_NOT_REQUESTED"
    },
    "generatedAt": {
      "const": "2026-08-15T20:08:05Z"
    },
    "authority": {
      "const": {
        "inspectMissingAddendumSha256": "sha256:a43fbb5ac8e795ab6b6bf51507d3489c9e803161419af50179d7f7e9bed97505",
        "inspectMissingOwnerReviewSha256": "sha256:ed73deb10f3ec9dcd5501f6d25f40ec7b140838494521ddd4cc9574b95afe324",
        "gateBConcurrencyAddendumSha256": "sha256:f18dce72f2a53ce11e530499156852e815c132093962ab7bdd5cee6dec587ae7",
        "gateBConcurrencyOwnerReviewSha256": "sha256:310c408393dc7aff38c935137f89690096869b3259c3e28bc03325b4dfd225c7",
        "ownerOutcomeEnvelopeConfirmed": true,
        "repositoryConstruction": "APPROVED_AND_CONSUMED_BY_KGC_LIC_MIC_ONLY",
        "replacementCampaign": "NOT_REQUESTED",
        "docker": "NOT_REQUESTED",
        "cleanup": "NOT_REQUESTED",
        "postgresql": "NOT_REQUESTED",
        "production": "NOT_REQUESTED",
        "gateC": "NOT_REQUESTED"
      }
    },
    "lineage": {
      "const": {
        "inspectAuthority": {
          "addendumHead": "15536817efe6b0b7a5c8014e912f02429f197ef1",
          "addendumTree": "503c9432fd2b75fd16857afe58c2eb78a24581da",
          "reviewHead": "7e07672563201d92db14ecf3adcbf5f6ad970b9f",
          "reviewTree": "34b9fd454725c15710946503af7d8be126fa09ab"
        },
        "inspectImplementation": {
          "head": "1e93280bc3842d40e6f797a38ca4bfa2a2277813",
          "tree": "14526ed95feae2da6c9c14a89ece48616822e4e8",
          "parentHead": "7e07672563201d92db14ecf3adcbf5f6ad970b9f",
          "exactDelta": "2_PATHS_0A_2M_0D_0R",
          "artifactAggregateSha256": "sha256:5dea77a0e5391f3283caab8a9b1d67f4a6ed8758be6be3631bad5283ca530f1f"
        },
        "gateBConcurrencyAuthority": {
          "addendumHead": "e21c441a6154f3c08b96ccbf7f0f7b693107b99a",
          "addendumTree": "8860d06a9ccc821be62bf62ee79cd356b8b7fb52",
          "addendumParentHead": "1e93280bc3842d40e6f797a38ca4bfa2a2277813",
          "reviewHead": "9f178918c416bd3be54e4cbc44e0c64567a78ca1",
          "reviewTree": "63e69b5594aa9ba6627b825b1ac4aa636e15605e",
          "reviewParentHead": "e21c441a6154f3c08b96ccbf7f0f7b693107b99a"
        },
        "gateBConcurrencyImplementation": {
          "head": "98392bf19356982c884961a1425cd97ff33811bf",
          "tree": "796684556d04368c3acd3926d0c86992affa205c",
          "parentHead": "9f178918c416bd3be54e4cbc44e0c64567a78ca1",
          "exactDelta": "2_PATHS_0A_2M_0D_0R",
          "artifactAggregateSha256": "sha256:0101d889a77749a0671e26490bf2bb8a1aeab14b8678ce54d959a250388f83b4"
        }
      }
    },
    "workset": {
      "const": {
        "predecessorImplementationPathCount": 2,
        "correctionImplementationPathCount": 2,
        "evidencePathCount": 3,
        "statusPathCount": 10,
        "newConstructionPathCount": 15,
        "addedPathCount": 4,
        "modifiedPathCount": 11,
        "newConstructionCommitCount": 3,
        "correctionImplementationPaths": [
          "scripts/r4-gate-b-physical-runner.mjs",
          "test/r4-gate-b-core/physical-runner.test.ts"
        ],
        "evidencePaths": [
          "docs/evidence/r4-public-core-local-postgres-integration-campaign-inspect-missing-correction.json",
          "schemas/r4/public-core/local-postgres-integration-campaign-inspect-missing-correction-artifact-index.json",
          "schemas/r4/public-core/local-postgres-integration-campaign-inspect-missing-correction-evidence.schema.json"
        ],
        "statusPaths": [
          "README.md",
          "docs/CONTROL.md",
          "docs/DECISIONS.md",
          "docs/NATIVE-HARNESS-ARCHITECTURE.md",
          "docs/PRODUCT.md",
          "docs/R4-PUBLIC-CORE-GATE-C-ACTIVATION-CARD.md",
          "docs/R4-PUBLIC-CORE-LOCAL-POSTGRES-INTEGRATION-CAMPAIGN-INSPECT-MISSING-CORRECTION-CONSTRUCTION-REPORT.md",
          "docs/README.md",
          "docs/ROADMAP.md",
          "docs/VALIDATION.md"
        ]
      }
    },
    "constructedContracts": {
      "const": {
        "inspectMissing": {
          "dockerCliVersion": "29.3.1",
          "missingStatus": 1,
          "missingStdoutByteCount": 1,
          "missingStdoutSha256": "sha256:01ba4719c80b6fe911b091a7c05124b64eeece964e09c058ef8f9805daca546b",
          "inspectKinds": [
            "image.inspect",
            "container.inspect",
            "network.inspect",
            "volume.inspect"
          ],
          "productionAndFakeShareRawParser": true,
          "unknownNeverBecomesAbsence": true,
          "rawBodiesRetained": false
        },
        "gateBConcurrency": {
          "oldFixedTerminalWaitMilliseconds": 10000,
          "terminalWaitBasis": "MIN_ABSOLUTE_AUTHORITY_OR_HELPER_START_CEILING_PLUS_EXISTING_CLEANUP_GRACE",
          "helperStartCeilingMilliseconds": 900000,
          "cleanupGraceMilliseconds": 2000,
          "retryCount": 0,
          "focusedDeadlineCases": 2,
          "defaultConcurrentGreenRuns": 2,
          "serialFullGreenRuns": 1,
          "realHelperStarts": 0,
          "providerCalls": 0,
          "physicalEffects": 0
        },
        "campaignV2DesignOnly": true,
        "campaignV2Prepared": false,
        "campaignV2Consumed": false
      }
    },
    "validation": {
      "const": {
        "testLanes": [
          {
            "laneId": "integration_campaign_inspect_missing_focused",
            "command": "node --import ./scripts/deny-external-network.mjs --test --test-name-pattern='(integration campaign|Docker missing diagnostics)' test/r4/public-core-local-postgres.test.ts",
            "total": 15,
            "passed": 15,
            "failed": 0
          },
          {
            "laneId": "local_postgres_runner_fake_deny_network",
            "command": "node --import ./scripts/deny-external-network.mjs --test test/r4/public-core-local-postgres.test.ts",
            "total": 176,
            "passed": 176,
            "failed": 0
          },
          {
            "laneId": "r4_offline_regression",
            "command": "npm run test:r4:offline",
            "total": 748,
            "passed": 748,
            "failed": 0
          },
          {
            "laneId": "gate_b_core_default_concurrent_run_1",
            "command": "npm run test:r4:gate-b-core",
            "total": 146,
            "passed": 146,
            "failed": 0
          },
          {
            "laneId": "gate_b_core_default_concurrent_run_2",
            "command": "npm run test:r4:gate-b-core",
            "total": 146,
            "passed": 146,
            "failed": 0
          },
          {
            "laneId": "gate_b_core_serial_full",
            "command": "node --import ./scripts/deny-external-network.mjs --test --test-concurrency=1 'test/r4-gate-b-core/**/*.test.ts'",
            "total": 146,
            "passed": 146,
            "failed": 0
          },
          {
            "laneId": "repository_spine",
            "command": "node --import ./scripts/deny-external-network.mjs --test test/*.test.ts",
            "total": 45,
            "passed": 45,
            "failed": 0
          }
        ],
        "checkLanes": [
          "node --check scripts/r4-gate-b-physical-runner.mjs",
          "node --check scripts/r4-public-core-local-postgres.mjs",
          "npm run typecheck -- --pretty false",
          "npm --workspace @forme/room run check:no-ai",
          "npm run r4:inventory",
          "npm run r4:docs:audit",
          "git diff --check"
        ],
        "preLicSourceInventoryFileCount": 293,
        "preLicSourceInventorySha256": "sha256:7fd1eab747216b9234399392006e4361bb0dd1874206468254a858cfb6d8089d",
        "strictAjvCandidateLic": true,
        "committedBytesOnly": true,
        "allPassed": true
      }
    },
    "effectAudit": {
      "const": {
        "newConstructionPaths": 15,
        "newConstructionCommits": 3,
        "dependencyChanges": 0,
        "lockChanges": 0,
        "sqlChanges": 0,
        "forensicRootReads": 0,
        "forensicRootWrites": 0,
        "externalNetworkCalls": 0,
        "dockerCliCalls": 0,
        "dockerDaemonCalls": 0,
        "dockerSocketResolutions": 0,
        "ociPulls": 0,
        "cleanupCalls": 0,
        "postgresConnections": 0,
        "sqlStatements": 0,
        "productRuntimeEffects": 0,
        "productionEffects": 0,
        "publicTrafficEffects": 0,
        "providerCalls": 0,
        "messagesSent": 0,
        "deployments": 0,
        "releases": 0,
        "spend": 0
      }
    },
    "documentationScope": {
      "const": {
        "operationalStatusSurfacesCurrent": false,
        "operationalStatusSurfaceCount": 9,
        "wholeRepositoryDocumentationCurrentClaimed": false,
        "statusFreezePending": true
      }
    },
    "artifacts": {
      "type": "object",
      "additionalProperties": false,
      "required": [
        "artifactIndex",
        "evidenceSchema",
        "implementationArtifacts"
      ],
      "properties": {
        "artifactIndex": {
          "const": {
            "path": "schemas/r4/public-core/local-postgres-integration-campaign-inspect-missing-correction-artifact-index.json",
            "byteCount": 6485,
            "sha256": "sha256:d90271f5d15e1b2ac42b23211283257822f74ac9795b244a8db306ed0e157125"
          }
        },
        "evidenceSchema": {
          "type": "object",
          "additionalProperties": false,
          "required": [
            "path",
            "sha256"
          ],
          "properties": {
            "path": {
              "const": "schemas/r4/public-core/local-postgres-integration-campaign-inspect-missing-correction-evidence.schema.json"
            },
            "sha256": {
              "type": "string",
              "pattern": "^sha256:[0-9a-f]{64}$"
            }
          }
        },
        "implementationArtifacts": {
          "const": [
            {
              "path": "scripts/r4-public-core-local-postgres.mjs",
              "commit": "1e93280bc3842d40e6f797a38ca4bfa2a2277813",
              "byteCount": 735755,
              "sha256": "sha256:f012fd876cc49bd14be3519af6aeef98d7451ab29c90c786a7f242f59915984c"
            },
            {
              "path": "test/r4/public-core-local-postgres.test.ts",
              "commit": "1e93280bc3842d40e6f797a38ca4bfa2a2277813",
              "byteCount": 196175,
              "sha256": "sha256:25e51e491a37e1e048e6bce590c8cf5d08599a4fa8b2fd02cf83a17523280b83"
            },
            {
              "path": "scripts/r4-gate-b-physical-runner.mjs",
              "commit": "98392bf19356982c884961a1425cd97ff33811bf",
              "byteCount": 656525,
              "sha256": "sha256:8e0a6afca5674975c150a40f6f9dafd9a0b1d84be1d4886a325fd0f88d370184"
            },
            {
              "path": "test/r4-gate-b-core/physical-runner.test.ts",
              "commit": "98392bf19356982c884961a1425cd97ff33811bf",
              "byteCount": 322161,
              "sha256": "sha256:d2efcb6ea9780b1c8d44bd1d58d4b3d0557baf68845c226226feac5a871dc6a3"
            }
          ]
        }
      }
    },
    "audits": {
      "const": {
        "committedKic": {
          "status": "PASS",
          "blockers": 0,
          "important": 0,
          "summaryByteCount": 351,
          "summarySha256": "sha256:7c1ea06b0f7c1422b29ef6eba6a92a063d1e6495e3d7a5cb6adccd535b1bd094"
        },
        "committedKgc": {
          "status": "PASS",
          "blockers": 0,
          "important": 0,
          "summaryByteCount": 350,
          "summarySha256": "sha256:aeb46997b467b5471f484de08c543b061e0caed398d9aa6c83200203252f231f"
        },
        "candidateLic": {
          "status": "PASS",
          "blockers": 0,
          "important": 0,
          "selfHashExcluded": true
        },
        "committedLic": "PLANNED_NOT_RUN_AT_LIC",
        "candidateMic": "PLANNED_NOT_RUN_AT_LIC",
        "committedMic": "PLANNED_NOT_RUN_AT_LIC"
      }
    },
    "readiness": {
      "const": {
        "inspectMissingCorrectionConstructed": true,
        "gateBConcurrencyCorrectionConstructed": true,
        "implementationEvidenceGreen": true,
        "statusFreezeComplete": false,
        "freshCampaignV2Prepared": false,
        "freshCampaignV2Consumed": false,
        "dockerExecuted": false,
        "cleanupExecuted": false,
        "physicalExecutionPerformed": false,
        "targetPostgresObserved": false,
        "targetCatalogObserved": false,
        "productRuntimeReady": false,
        "trafficReady": false,
        "gateCReady": false,
        "issue67Done": false,
        "r4Done": false
      }
    },
    "stop": {
      "const": "LOCAL_POSTGRES_INTEGRATION_CAMPAIGN_INSPECT_MISSING_CORRECTION_IMPLEMENTATION_EVIDENCE_GREEN / STATUS_FREEZE_REQUIRED / FRESH_INTEGRATION_CAMPAIGN_V2_EXECUTION_APPROVAL_REQUIRED / PRODUCTION_NOT_REQUESTED / GATE_C_NOT_REQUESTED"
    }
  }
}
